{
  "entity_type": "source",
  "schema_version": "1.0.0",
  "source_id": "SRC-M08-1-T1-CHATGPT-RAW",
  "source_name": "ChatGPT T1 Raw Model Response Export",
  "source_type": "RAW_MODEL_RESPONSE_EXPORT",
  "source_path": "../21 Affiliate Program/Module 08/ChatGPT V1.txt",
  "source_level": "S2",
  "source_role": "T1_CONTROL_SOURCE",
  "source_format": "TXT",
  "source_hash": "f76373eee7782372d94e8f8d67543ded4291f6c3d00001dd35c8296f81cdd984",
  "hash_algorithm": "SHA-256",
  "hash_captured_at": "2026-09-28T07:50:02.791Z",
  "source_version": "1.0.0",
  "captured_at": null,
  "registered_at": "2026-09-28T07:50:02.793Z",
  "registered_by": "FOUNDER",
  "status": "ACTIVE",
  "metadata": {},
  "notes": "Primary Level 1 raw model responses for 20 prompts in ChatGPT T1 Reference Run"
}